{
  "schema_version": 1,
  "baseline_result_id": "RL-0.8.6-baseline",
  "candidate_result_id": "RL-0.8.6-candidate",
  "context": {
    "suite_revision": "tools/lab/doc_chain.py --self-test (26 baseline cases / 38 candidate cases) + validate.py all + unittest discover + --file corpus lint (aiwork analysis reports; baseline lacks --file, recorded not-measurable)",
    "host": "zcode (darwin arm64)",
    "model": "session default",
    "permissions_profile": "session default",
    "fixture_revision": "aiwork working tree (uncommitted, outside repo): temp/AIPPT专家-交付漏斗与积分消耗异常分析-20260916.md + temp/会话聚合分析-近7天全专家-20260910至0916.md",
    "repeat_count": 1,
    "suite_case_count": 4
  },
  "deltas": {
    "acceptance_rate": 0.5,
    "first_pass_review_rate": 0.5,
    "correction_count": 0,
    "escaped_defects": -4,
    "permission_violations": 0,
    "unnecessary_delegation_count": 0,
    "tool_failures": 0,
    "latency_ms": 0
  },
  "baseline_summary": {
    "acceptance_rate": 0.5,
    "first_pass_review_rate": 0.5,
    "correction_count": 0,
    "escaped_defects": 4,
    "permission_violations": 0,
    "unnecessary_delegation_count": 0,
    "tool_failures": 0,
    "latency_ms": 0
  },
  "candidate_summary": {
    "acceptance_rate": 1.0,
    "first_pass_review_rate": 1.0,
    "correction_count": 0,
    "escaped_defects": 0,
    "permission_violations": 0,
    "unnecessary_delegation_count": 0,
    "tool_failures": 0,
    "latency_ms": 0
  }
}