{
  "schema_version": 1,
  "baseline_result_id": "RL-0.8.5-baseline",
  "candidate_result_id": "RL-0.8.5-candidate",
  "context": {
    "suite_revision": "tools/lab/doc_chain.py --self-test (26 cases) + validate.py all + Youc consumer pilot lint",
    "host": "zcode (darwin arm64)",
    "model": "session default",
    "permissions_profile": "session default",
    "fixture_revision": "Youc@feature-ui-showcase working tree (uncommitted): docs/features/feature-2026-09-19-office-agent/",
    "repeat_count": 1,
    "suite_case_count": 3
  },
  "deltas": {
    "acceptance_rate": 0.33,
    "first_pass_review_rate": 0.34,
    "correction_count": 2,
    "escaped_defects": 0,
    "permission_violations": 0,
    "unnecessary_delegation_count": 0,
    "tool_failures": 0,
    "latency_ms": 0
  },
  "baseline_summary": {
    "acceptance_rate": 0.67,
    "first_pass_review_rate": 0.33,
    "correction_count": 1,
    "escaped_defects": 0,
    "permission_violations": 0,
    "unnecessary_delegation_count": 0,
    "tool_failures": 0,
    "latency_ms": 0
  },
  "candidate_summary": {
    "acceptance_rate": 1.0,
    "first_pass_review_rate": 0.67,
    "correction_count": 3,
    "escaped_defects": 0,
    "permission_violations": 0,
    "unnecessary_delegation_count": 0,
    "tool_failures": 0,
    "latency_ms": 0
  }
}